INDEX,TEXT ,STYLE TEXT
15,"Во-первых, во всем мире резко вырос экономический спрос. Люди откладывали удовлетворение своих потребностей и в кризисное довоенное десятилетие, и во время войны, но теперь спешили эти потребности удовлетворить. Одновременно восстанавливалась промышленность: мир оказался завален товарами. Во-вторых, шли процессы деколонизации: появлялись новые государства, а в них возникал запрос на строительство собственной промышленности, которая должна была обеспечить экономический суверенитет. Быстрый экономический рост 1950–1960-х годов вызвал у специалистов тревогу о том, как долго этот рост можно будет поддерживать. Эта тревога выразилась в нескольких программных заявлениях, среди которых можно выделить знаменитый доклад Римского клуба «Пределы роста» 1972 года. В нем были сформулированы опасения о том, что человечество потребляет больше ресурсов, чем планета в состоянии ему поставлять. Авторы доклада — представители мировой политической, финансовой, культурной и научной элиты — пришли к выводу о том, что приблизительно к 2000 году человечество подойдет к пределу роста, за которым должен последовать коллапс. Идея не была большим новшеством: одним из первых ее развил в начале XIX века английский политэконом Томас Мальтус. Неизбежность краха после периода быстрого роста называется по его имени мальтузианской ловушкой. Однако только к 1970-м годам мальтузианская ловушка стала для многих не просто нюансом экономической теории, а вполне вероятным сценарием недалекого будущего.",публицистический стиль
16,"Одновременно с формированием представления о конечности ресурсов к началу 1960-х начала возникать идея об ответственности человечества перед планетой. В истории этой идеи важную роль сыграла вышедшая в 1962 году книга американского биолога Рэйчел Карсон «Безмолвная весна» о губительном влиянии инсектицидов на насекомых и птиц. Карсон выявила конфликт между уважаемой, общественно полезной деятельностью промышленников — производителей полезных инсектицидов — и природой. Главной и новой для общественной мысли того времени стала идея Карсон о том, что полезная человеку деятельность может быть в долгосрочной перспективе для человека же вредной: инсектициды, сокращая популяцию птиц и насекомых, снижают эффективность сельского хозяйства, а также приводят к заболеваниям у людей. Книга вызвала огромную общественную дискуссию. Она широко обсуждалась в американской прессе и на телевидении; компании-производители инсектицидов начали масштабную, но провальную юридическую кампанию против Карсон и ее издателей. «Безмолвная весна» создала прецедент и изменила лицо экологического активизма в США и во всем мире: он стал и до сих пор остается вовсе не эгоистичной заботой человека о собственном процветании — теперь это борьба за природу и ради нее.",публицистический стиль
17,"Идеи о том, что в природе все взаимосвязано, ресурсы конечны, а вмешательство должно быть осторожным, в научном сообществе сформировались гораздо раньше, чем в обществе в целом. Интересно, что корни этого представления лежат скорее в экономической реальности, чем в экологии как науке. До конца XIX — начала XX века наука развивалась, постоянно уменьшая, дробя объект исследования на части. Каждая дисциплина выделяла свое поле интересов, а в нем — свои ключевые темы. Для того чтобы заниматься наукой, ученому нужно было все время сужать область своего исследования. Эта тенденция в некотором смысле противоречила экологическому подходу, который, напротив, стремится объединить множество объектов и рассматривать их как систему. Первоначальное объединение разрозненных объектов исследования произошло на почве экономики, а не естественного развития науки. Именно экономические задачи потребовали, чтобы знания геологов, физиков, химиков были применены к единому объекту, например территории страны.",публицистический стиль
18,"Дискуссии о том, как использовать природные ресурсы так, чтобы их хватило надолго, велись в российских университетах еще до Октябрьской революции. В 1916 году при Императорской Академии наук была создана Комиссия по изучению естественных производительных сил России. Она решала актуальные для того времени задачи: замещение импорта, промышленный суверенитет, безопасность. Но в отчетах этой комиссии прослеживается и желание сохранить по крайней мере часть ресурсов для будущих поколений. В годы Гражданской войны в Сибири работал Институт исследования Сибири, также ставивший перед собой задачи освоения и разработки новых подходов научного изучения и такого развития промышленности, которое сейчас можно было бы назвать «устойчивым». Даже в дискуссиях о традиционных отраслях промышленности, таких как металлургическая и угольная, актуализировались вопросы конечности ресурсов и частично последствиях, которые будет иметь природа после освоения этих ресурсов. Другой причиной, по которой формирование экологического подхода стимулировали не ученые, а государство и экономические задачи, ставившиеся перед научным сообществом, стала традиционная траектория развития научных исследований и самих ученых. В процессе постоянного сужения области своей специализации ученые крайне редко могли позволить себе выход за пределы своей темы и тем более своей дисциплины, как этого требует экологический подход. Можно назвать отдельные имена ученых, совершивших такой выход: в Германии это сделал Карл Мебиус, в России — Владимир Вернадский, Василий Докучаев. Их объединяло признание и высокий, почти непоколебимый статус в академии — другими словами, у них была возможность выйти за рамки своей темы и взглянуть на вещи шире. Чтобы дискуссия о некотором «правильном», то есть по крайней мере экономном, освоении природных ресурсов перешагнула пороги ученых кабинетов, общество должно было сильно измениться.",публицистический стиль
19,"Внедрение экологического подхода редко происходило без конфликтов. Аналогом бури, которую вызвала в американских СМИ «Безмолвная весна» Рейчел Карсон, в СССР стали обсуждения проектов строительства целлюлозно-бумажного комбината на берегу озера Байкал и поворота сибирских рек. По сути они обе сводились к вопросу о том, можно ли человеку вмешиваться в природу, и о последствиях такого вмешательства. Проект строительства Байкальского ЦБК начали обсуждать в конце 1950-х годов. Он вполне укладывался в продуктивистскую логику эффективного освоения природных богатств. Стране нужна была целлюлоза, качество ее зависит от качества воды, а вода озера Байкал, как известно, очень чистая. Строить комбинат на Байкале было логично, эффективно, выгодно: на любом другом водоеме потребовалось бы затратить гораздо больше средств на строительство системы очистки воды. Против строительства комбината выступила коалиция ученых Сибирского отделения АН СССР, к которым позже присоединились биологи, ботаники, геологи, географы из центральных областей страны. Для многих эта критика стала большим сюрпризом. Она шла вразрез с представлением о том, что наука существует для помощи народному хозяйству — эту идею советское государство воспитывало в своих ученых, и сами они в основном разделяли это убеждение. Но проект ЦБК на Байкале критиковали в том числе те люди, которые до сих пор своей научной работой вносили огромный вклад в развитие экономики. Один из самых ярких примеров здесь — академик Трофимчук, герой социалистического труда, открывший множество нефтяных месторождений. Теперь же он и подобные ему выступали против министров советского правительства, утверждая, что бывают ситуации, в которых экономические задачи менее важны, чем сохранение природного достояния. Дискуссия о Байкальском ЦБК шла более 40 лет; в 1966 году комбинат заработал, в 2013 году — закрыт, на его территории начались работы по восстановлению среды и превращению территории в санаторно-курортную зону. Другой проект — поворот сибирских рек для снабжения водой засушливых регионов Средней Азии — встретил схожую оппозицию советской академии, но был заблокирован гораздо быстрее. Роль в этом сыграло полное отсутствие возможности просчитать последствия его реализации, в первую очередь возможные убытки. В самом деле, в дискуссии, где одна сторона оперирует эффективностью и выгодой, а другая — сохранением экосистем, важно правильно выставить обменный курс. Чаще всего это означает, что нужно подсчитать, во сколько обойдется возмещение ущерба природе. Эти подсчеты — всегда задача ученых.",публицистический стиль
20,"Споры о Байкальском ЦБК и проекте поворота сибирских рек сыграли важную роль в формировании советского экологического законодательства — норм о допустимых концентрациях разных веществ в воде, почве и воздухе, о состоянии сточных вод, охране лесов. Если первые подобные нормы права, принятые после революции, исходили из стремления сохранить ресурсы для потомков, то новые законы предназначены были для защиты человека и его здоровья. Третий поворот в области экологического законотворчества начался в СССР в 1980-е годы и продолжается до сих пор. Он стимулировал появление норм, которые защищают окружающую среду не ради человека, а ради нее самой. Особый вклад в этот поворот внесла чернобыльская авария, которая сильно подняла востребованность экологических вопросов в обществе. Помимо удара, нанесенного имиджу ядерной энергетики, Чернобыль сильно ударил по продуктивистскому представлению о науке, которое продвигалось в СССР. Согласно этому представлению, человеческому разуму подвластно все — разумеется, только при правильной социальной и политической организации. Не виделось никаких границ для познания и дальнейшего использования сил природы. Атомный проект был самым ярким подтверждением того, что ученые проникли в тайну природы и сумели поставить ее на службу народу. После Чернобыля говорить о науке в таком ключе было уже невозможно. Он был воспринят как напоминание о том, что у наших ошибок, в том числе научных, есть цена. После 1986 года популярность экологических обсуждений в СССР резко выросла, они превратились в канал выражения мнений ученых, журналистов, политиков и просто граждан. Сформировалось представление о том, что в экологическом взгляде заинтересованы все. Так СССР получил к 1991 году одно из самых прогрессивных в мире экологических законодательств, включающее понятие компенсации за нанесенный окружающей среде ущерб.",публицистический стиль
21,"История компьютерной обработки естественного языка (natural language processing) начиналась с очень простых алгоритмов: десяток правил плюс небольшой словарь. Затем появились более разветвленные системы из тысяч логических шаблонов со сложной иерархией приоритетов между ними. Дальше возникло машинное обучение: люди научили алгоритмы выводить правила самостоятельно — они существовали не в явном виде логических условий, а в виде абстрактных признаков внутри алгоритма. А сегодня используется специфический вид машинного обучения — глубокое обучение. Оно представляет собой метод на базе искусственного интеллекта, который использует многоуровневые алгоритмы машинного обучения для извлечения все более сложных характеристик из необработанных входных данных. Первый алгоритм, который мог поговорить с человеком, появился в 1966 году. Чат-бот «Элиза» был создан американским ученым Джозефом Вейценбаумом как эксперимент. Программа пародировала общение психоаналитика с клиентами: она задавала собеседнику вопросы и анализировала их ответы по ключевым словам, а дальше выдавала следующий встречный вопрос. Выбор роли психоаналитика был продиктован тем, что в таком диалоге можно вместо ответа задавать вопрос за вопросом и при этом не выглядеть странно. При этом чат-бот «Элиза» никак не мог быть по-настоящему похож на психоаналитика: реальный специалист не просто задает вопросы, а профессионально ведет клиента к нахождению ответов. К слову, этот пример отражает вообще всю историю работы над нейросетями. Даже самая продвинутая программа все-таки не может сравниться с разумным существом.",публицистический стиль
22,"Раньше языковые модели применялись для того, чтобы выполнять самые простые задачи, например генерировать перевод текста. Представим, что у нас есть исходный текст, мы хотели бы получить его на другом языке и нам необходимо создать максимально реалистичный перевод, похожий на настоящий. Или мы стремимся распознать голос, и языковая модель помогает нам правильно понять то, что говорится на записи с не очень высоким качеством. Но сегодня языковые модели тренируются решать более сложные задачи. Если все началось с того, что разработчики пытались прогнозировать с помощью языковых моделей следующее слово, то сегодня у нас есть система, которой можно давать любые задачи, сформулированные в текстовом виде. В лаборатории искусственного интеллекта такие модели используют для разных целей. Например, для того, чтобы по записям электронной медицинской карты предполагать наиболее вероятный диагноз. В коротком отрезке задача специалистов — упростить работу врачей в поликлиниках. Для этого используют языковую модель, которая обучена разбирать записи электронных медицинских карт и, анализируя данные посещений, предполагать три наиболее вероятных диагноза. Такая система поддержки принятия врачебных решений, разработанная Сбером и Правительством Москвы, была запущена во всех поликлиниках Москвы. Но на данном этапе языковая модель умеет правильно понимать только саму медицинскую карту: она анализирует анамнез, жалобы, результаты осмотра. При этом модель не умеет оценивать результаты осмотра и замечать необычные детали, обращаться к медицинской литературе и делать таким образом необычные логические выводы.",публицистический стиль
