INDEX,TEXT ,STYLE TEXT
23,"Не так давно интернет облетело видео, как в Сан-Франциско полиция останавливает беспилотный автомобиль. Выглядит это очень комично: сотрудник заглядывает в машину и видит, что водителя в ней нет. Но за смешным видео стоит серьезная проблема, которую человечеству предстоит решить в будущем. Например, при анализе медицинских изображений машина только подсказывает специалисту, а конечное решение о постановке того или иного диагноза полностью лежит на плечах врача. Именно поэтому так важны корректная работа создателей подобных систем и правовое регулирование этого вопроса в будущем. Пока специалисты пытаются использовать более простые и понимаемые методы, чистить входную выборку, исключать из нее потенциально вредные данные. И во многом эту задачу удается решить.",публицистический стиль
24,"Второе направление работы лаборатории — это применение искусственного интеллекта в сфере образования. Цель разработчиков — сделать процесс обучения интереснее и эффективнее. Для того чтобы это направление запустить, лаборатория долгое время консультировалась с ведущими вузами и узнала, что многие преподаватели хотели бы иметь генератор заданий для студентов по программированию и математике. Как известно, любое задание не имеет известного решения только один поток, а дальше студенты начинают обмениваться правильными ответами. Над решением этой проблемы и работает лаборатория. Еще одна задача специалистов — создать способ проверки свободно сформулированных ответов на тестовые задания. Это поможет создавать не простые тестовые задачи, где есть понятные варианты, а более широкие и объективные системы проверки знаний. Есть и такие разработки, как, например, генерация трека обучения для конкретного человека, персональная модификация образовательных материалов.",публицистический стиль
25,"В некотором смысле современные методы искусственного интеллекта на основе нейросетей, глубокого обучения — это нечто магическое. Разработчики имеют в распоряжении лишь некие примитивы — строительные блоки, из которых можно собрать все что угодно. Хотите определять, что изображено на картинке, хотите переводить литературные произведения? Пожалуйста. Но при этом никто не знает, как такие модели работают внутри, что происходит под капотом современных языковых моделей.",публицистический стиль
26,"Вся история искусственного интеллекта заключается в том, что ученые и разработчики все время пытаются решить искусственный интеллект «в общем». Они стремятся создать такой искусственный интеллект, который сможет зайти на любую кухню и приготовить кофе. Для этого специалисты используют термин «точка технологической сингулярности» — так они обозначают момент, когда искусственный интеллект осознает себя и сможет быть по-настоящему самостоятельным. Однако идея про общий искусственный интеллект имеет вопросы, на которые нет понятных ответов. Самый простой: зачем такой искусственный интеллект нужен человечеству? Станет такой разум другом для людей? Возможно, текущий уровень развития технологий — это и есть то, с чем и стоит работать.",публицистический стиль
27,"Биоарт (bioart) — это широкое понятие, так называют искусство, взаимодействующее с науками о жизни. Некоторые обозначают этим термином искусство, которое имеет дело только с живыми организмами, но я не считаю, что стоит вводить такие ограничения. В своих работах я, наоборот, часто использую мертвое — например, ДНК и убитые бактерии. Триггером для творчества для меня является интерес к жизни, в частности к инфекционным заболеваниям, с которыми я работаю с 2010-х годов. Инфекционные заболевания — и речь не только о коронавирусе, но также о туберкулезе, малярии и так далее — одни из основных причин смертности, они оказывают огромное влияние на жизнь людей, которые их перенесли. Но о них очень неохотно говорят, и это меня и удивило. Так я начала изучать механизмы жизни: создание антибиотиков, распространение заболеваний, а также геномику и синтетическую биологию — направление, которое занимается редактированием ДНК организмов. Но в то же время в своих работах я обращаюсь и к истории искусства, в них есть и этическая, и эстетическая составляющая. Я говорю не только о такой эстетической категории, как прекрасное, но также об ужасном, отвратительном, пугающем и возвышенном.",публицистический стиль
28,"Промышленные революции и массовое производство сделали возможным появление экономики нового типа — линейной. Такая модель (ее иногда называют моделью «бери, используй, выбрасывай») предусматривает использование природных ресурсов, производство из них товаров, их утилизацию и бесконечное повторение этого цикла. Но уже в середине ХХ века стало понятно, что ресурсы планеты ограничены и с ростом населения опасность их истощения становится все более реальной. В качестве альтернативы линейной экономике экологи и экономисты предложили экономику замкнутого цикла. Она предусматривает использование возобновляемых ресурсов, продление срока жизни уже произведенных товаров и безотходное производство: продукты одного процесса становятся расходными материалами для другого. О том, возможен ли переход к циклической экономике и что нужно сделать для его осуществления, ПостНауке рассказали кандидат экономических наук, доцент Департамента мировой экономики ВШЭ Георгий Сафонов и независимый эксперт в области устойчивого развития Мария Жевлакова.",публицистический стиль
29,"Линейная модель экономики называется так потому, что видит экономику как линию с началом и концом: природные ресурсы (древесина, вода, полезные ископаемые) добывают, из них производят товары, товары используют и выбрасывают, затем все повторяют сначала. Линейная экономическая модель основана на том, чтобы как можно большее количество товаров как можно быстрее пропустить через этот процесс. Из-за этого ее иногда называют моделью «бери, используй, выбрасывай» — произведенные товары в итоге оказываются на свалке.До первой промышленной революции, которая началась в Европе в конце XVIII века, массового производства не существовало. Вместо него были ремесла и ручной труд: кузнец ковал, гончар делал горшки, портной шил и так далее. Все они старались производить товары как можно более высокого качества, которые могли использоваться долгие годы. С изобретением паровых машин ситуация изменилась: появилась возможность производить товары в больших количествах. Тогда и возникла линейная экономика. Сначала производители ориентировались на долгоживущие продукты, но со временем стратегия изменилась: они стали сокращать срок эксплуатации выпускаемой продукции. Например, автомобили первоначально делали из толстой стали, они были тяжелыми, надежными и оставались на ходу десятки лет. Позже на смену им пришли более легкие модели, быстрее приходящие в негодность. Чем дальше, тем больше этот процесс ускорялся. Запланированное устаревание — намеренное сокращение срока эксплуатации товаров. Когда компании разрабатывают товары (например, лампочку), они заранее проектируют их таким образом, чтобы они служили ограниченное количество времени, а затем ломались и потребители покупали им на смену новые. Правительства стремились к тому, чтобы производить как можно больше товаров, увеличивать ВВП и таким образом обеспечивать благосостояние населения. Это создавало стимулы использовать природные и трудовые ресурсы все в больших масштабах. В середине-конце ХХ века бурный рост потребления достиг своего апогея благодаря глобализации. Производства перенесли в страны с дешевой рабочей силой: Китай, Индию, в Юго-Восточную Азию и Латинскую Америку. Мир делился на регионы, превращавшиеся в цеха по производству товаров, которые затем отправляли на другой конец света",публицистический стиль
30,"Цифровым искусством» (англ. digital art) сегодня называют художественные практики с использованием цифровых технологий. Начиная с 1960-х годов, помимо аналоговых материалов — карандашей и красок, металла и глины, магнитной ленты для звуковой и видеозаписи, — в руках у художников оказались новые инструменты — устройства-посредники, чья работа связана с электронными вычислениями и представлением данных в виде кода. На протяжении полувека цифровое искусство называли по-разному: компьютерным, мультимедийным или киберискусством. Сейчас эти определения вытеснены широко распространенными терминами «медиаискусство» или «искусство новых медиа». Однако насколько нова сама идея оцифровки информации? Теоретик медиа Вилем Флюссер уверен: идеей повсеместного проникновения цифры в нашу жизнь мы обязаны Новому времени, когда естествоиспытатели заявили, что книга природы написана языком математики. С этого момента началось превращение природы в математическую модель, с которой можно производить научные и технические операции. Медиатеоретики видят в истории развития средств коммуникации отражение того, как менялись способы мышления: от чувственного познания четырехмерного мира к созданию цифровой модели реальности и самого человека, существующего в ней. Максим Мирошниченко, кандидат философских наук, сотрудник Центра истории знания ИГИТИ ВШЭ, преподаватель кафедры биоэтики ЮНЕСКО РНИМУ — Благодаря возникновению новых систем электротехнической коммуникации, в частности интернета, мы оказались в таком состоянии, что пространство и время обессмыслились. Мы все будто бы всегда находимся вместе. Маршалл Маклюэн ввел понятие имплозии, «сжатия», чтобы обозначить одновременность и находимость всего в одной непространственной точке. Флюссер тот же процесс называет абстрагированием: с одной стороны, мы отказались от тела, от субъективности и от материального мира, но в то же самое время вернулись к ним уже в новом качестве. Цифровизация приводит нас к пересмотру отношения к материальности и телесности и поиску новых способов описания и проживания опыта нахождения в мире.",публицистический стиль
31,"До ХХ века философы, рассуждая о разуме и интеллекте, чаще всего рассматривали тело только в качестве посредника для исполнения мыслительных процессов, лишенного собственной значимости. В прошлом веке философия наконец обратилась к телу и стала анализировать воплощенный опыт. Медиатеория подхватила это веяние и привнесла в изучение телесности собственные идеи. Так, Юджин Такер отталкивается от биомедицинских исследований тела, генетических и биотехнологических разработок, чтобы показать, что тело, которое представляется нам несомненной изначальной данностью нашего существования, всегда гипертрофированно опосредовано теми знаниями, которыми мы о нем обладаем. В 1950-е годы утвердилась новая модель описания как тела человека, так и его мышления — машина. И эта модель оказалась рабочей: современные биомедицинские технологии, такие как бионика, протезирование, трехмерная печать искусственных органов, трансплантация и ксенотрансплантация, оправдывают интерпретацию тела как модулярной системы, которая состоит из заменяемых частей. Медиатеоретик Марк Хансен отметил, что в XX веке представители феноменологической традиции прибегали к техническим метафорам в разговоре о человеческом сознании. В феноменологии основной структурой, через которую тело существует в мире, является время. При описании этой структуры философы анализировали развертывание звука во времени при помощи технического новшества — звукозаписи. Оказалось, что граница между технологическим и биологическим достаточно условна, и этот факт бросает серьезный вызов и философии, и медиаисследованиям. Представления о человеке как о системе с более или менее предсказуемым поведением, которое можно моделировать, получили применение в алгоритмах соцсетей и маркетплейсов. Они отслеживают поведение человека, историю его поисковых запросов и на этом основании делают предсказания, которые оказываются на удивление точными. Возможность такого технического чуда заложена именно в том, что человек сам воспринимается как некая вычислительная машина, направлять которую может другая машина, уже рукотворная. Несмотря на эффективность механистической модели человека, искусственный интеллект пока не проявил себя в предсказывании человеческой деятельности, выходящей за рамки повседневного автоматизма (проматывания лент соцсетей и совершения покупок), а именно творческой. На сегодняшний день уже невозможно мыслить человека как некую абстрагированную систему: на смену этой метафоре пришел образ рассеянной сети, которая состоит из очень разных элементов и процессов. И это самый настоящий кошмар для философии. Мы постепенно утрачиваем очертания человекоподобного субъекта. Для медиаисследований оказывается релевантным разговор о постчеловеке или не-человеке, то есть о неких новых формах существования, которые не укладываются в общепринятые критерии человечности. И речь идет не о научно-фантастических сценариях, а о наблюдаемых уже сейчас явлениях. Например, в биомедицине человек рассматривается как система, где органы являются заменимыми запчастями, которые можно брать у доноров или печатать на 3D-принтерах. Взгляд на человека как на некий генетический аппарат, который можно редактировать и производить с ним различные манипуляции, или идея о достижении цифрового бессмертия посредством копирования мозга на синтетический кремниевый носитель уже стали значимой частью нашей культурной реальности. Новые возможности имплантации и «продления» тела интригуют и художников, которые используют их совсем не тривиально. Австралиец кипрского происхождения Стеларк с середины 1990-х проводит эксперименты над собственным организмом: позволяет зрителям дистанционно стимулировать его мышцы разрядами тока, строит паукообразный экзоскелет, который приводится в движение жестом кисти, проводит видеотрансляции из своего желудка и вживляет под кожу импланты. Его мечта — третье ухо на предплечье, которое «слышало» бы то же самое, что и художник, через микрофон и отправляло сигнал во Всемирную сеть.",публицистический стиль
